{
 "$schema": "../schema/features.schema.json",
 "id": "level4",
 "level": 4,
 "name": "Parallel processing",
 "description": "Many cores and many waits: parallel groups, channels, streams with back-pressure, tasks in a job (`async`, `spawn`, `await`), deadlines and cancellation, and region memory. Generics for classes, traits and abstract classes also arrive here. The results of parallel code must be deterministic: it is ",
 "features": [
  {"id": "F-LIB-11", "name": "Logging and observability", "status": "open", "summary": "Structured logs, job events, run reports, trace ids.", "doc": "level4/F-LIB-11.md"},
  {"id": "F-LIB-12", "name": "Testing module `test`", "status": "done", "summary": "Checks that print ok/FAIL, counters, summary that raises.", "doc": "level4/F-LIB-12.md", "spec": ["library/test.md"]},
  {"id": "F-LNG-11", "name": "Traits, abstract classes, generics", "status": "done", "summary": "trait, required methods, abstract classes, class Name(:T) with Box(:Integer)(5), constraints (:T <: Comparable), library traits Iterable, Stream, Comparable, Printable.", "doc": "level4/F-LNG-11.md"},
  {"id": "F-LNG-17", "name": "Stream type", "status": "partial", "summary": "Stream(:T) <: Iterable(:T), read by for with back-pressure; at level 4 Channel(:T) is the stream, and lists get batch(n) and split(k).", "doc": "level4/F-LNG-17.md"},
  {"id": "F-LNG-18", "name": "`Atomic(:T)`", "status": "partial", "summary": "A class of the standard library that wraps the atomic of the machine, for Logic, numbers, references and ordinals; class Name <: Atomic(:T).", "doc": "level4/F-LNG-18.md"},
  {"id": "F-MTK-01", "name": "Parallel aspects", "status": "done", "summary": "parallel … do start … done, barrier, data rules, errors as a job.", "doc": "level4/F-MTK-01.md"},
  {"id": "F-MTK-02", "name": "Worker pool and scheduler", "status": "partial", "summary": "$cores, M:N, a waiting aspect gives its core away.", "doc": "level4/F-MTK-02.md"},
  {"id": "F-MTK-03", "name": "Channels", "status": "done", "summary": "Channel(:T), send, receive, close, pipelines, deadlock detection, time-out.", "doc": "level4/F-MTK-03.md"},
  {"id": "F-MTK-04", "name": "Tasks in a job", "status": "done", "summary": "async subprograms, spawn, await; the tasks of a job share its core.", "doc": "level4/F-MTK-04.md"},
  {"id": "F-MTK-05", "name": "Deadlines and cancellation", "status": "done", "summary": "Per-group time limits, cancel or collect errors.", "doc": "level4/F-MTK-05.md"},
  {"id": "F-SPEC-05", "name": "Multitasking semantics", "status": "partial", "summary": "semantics/multitasking.md: parallel groups, channels, tasks in a job, durations, determinism.", "doc": "level4/F-SPEC-05.md", "spec": ["semantics/multitasking.md"]},
  {"id": "F-TLS-04", "name": "Debugger", "status": "partial", "summary": "Debug mode, halt breakpoints, step, print variables, reports.", "doc": "level4/F-TLS-04.md"},
  {"id": "F-TLS-08", "name": "Formatter and linter", "status": "done", "summary": "eve fmt, eve lint.", "doc": "level4/F-TLS-08.md"},
  {"id": "F-TLS-09", "name": "Editor support", "status": "partial", "summary": "Syntax colors for VS Code and GitHub, then a language server.", "doc": "level4/F-TLS-09.md"},
  {"id": "F-VM-05", "name": "Region memory", "status": "partial", "summary": "Arena per aspect call, job and request; long-lived heap for modules and channels.", "doc": "level4/F-VM-05.md"}
 ]
}
