{
 "$schema": "../schema/features.schema.json",
 "id": "all",
 "level": null,
 "name": "Tools, documents, bytecode and release",
 "description": "Work that does not belong to one level. The tools: the command line, the test runner, the documentation generator, the smoke test and the benchmarks; the documents: the tutorial, the compiler manual, the specification tables and the licenses; the second engine, the bytecode compiler and machine, the portable `.evb` file and the embedding API; and the road to a stable release: package manager, hardening, the compiler registry and the compiler course. A feature here is checked at every level, for example by running all levels on both engines.",
 "features": [
  {"id": "F-DAT-07", "name": "Database synchronization", "status": "open", "summary": "Keep two databases consistent (manifest).", "doc": "all/F-DAT-07.md"},
  {"id": "F-DOC-01", "name": "Tutorial, language part", "status": "partial", "summary": "The topic pages reviewed and consistent with the decisions.", "doc": "all/F-DOC-01.md"},
  {"id": "F-DOC-04", "name": "Compiler manual", "status": "partial", "summary": "Implement, usage, generated feature tables, implemented features.", "doc": "all/F-DOC-04.md"},
  {"id": "F-DOC-06", "name": "Compiler course", "status": "open", "summary": "The student track: milestones, bytecode, memory, scheduling, WASM (compiler.html).", "doc": "all/F-DOC-06.md"},
  {"id": "F-DOC-07", "name": "Manual generator", "status": "done", "summary": "generator/evegen.py builds the manual from the features of the specification, the tracking files of the tests and the benchmark history, writes an index of the specification and...", "doc": "all/F-DOC-07.md"},
  {"id": "F-SPEC-07", "name": "Machine-readable tables with schemas", "status": "done", "summary": "JSON schemas, script/speccheck.py.", "doc": "all/F-SPEC-07.md"},
  {"id": "F-SPEC-08", "name": "Conformance levels", "status": "partial", "summary": "Level 1 (a single script), level 2 (functions, procedures, lambdas, aspects), level 3 (modules, classes), levels 4 to 7, with the expected-output convention.", "doc": "all/F-SPEC-08.md"},
  {"id": "F-SPEC-09", "name": "Compiler registry and approval", "status": "open", "summary": "How a third-party implementation claims a spec version and a level (S6.3, S6.4).", "doc": "all/F-SPEC-09.md"},
  {"id": "F-SPEC-10", "name": "Licenses and trademark", "status": "done", "summary": "BUSL-1.1 code, CC BY-NC-SA 4.0 spec and documents, TRADEMARK.md.", "doc": "all/F-SPEC-10.md"},
  {"id": "F-TLS-01", "name": "Command line (CLI)", "status": "done", "summary": "eve script.eve, --check, --execute, -h, -v, -s, -d, -x, -i, -t, exit codes 64–66.", "doc": "all/F-TLS-01.md"},
  {"id": "F-TLS-05", "name": "Command files and serve mode", "status": "done", "summary": "(scheduled for removal, replaced by F-TLS-13): .vmc slot, workflow commands load, parse, run, errors, ast, inspect, status.", "doc": "all/F-TLS-05.md"},
  {"id": "F-TLS-06", "name": "Test runner", "status": "done", "summary": "script/runtest.py for levels, project tests, several drivers per project, /@expect/ blocks, reports in JSON for the tests that fail, and the result of every run in the tracking file of the suite...", "doc": "all/F-TLS-06.md"},
  {"id": "F-TLS-07", "name": "Documentation generator `eve --doc`", "status": "done", "summary": "Markdown from  comments and signatures, a command of the VM.", "doc": "all/F-TLS-07.md"},
  {"id": "F-TLS-10", "name": "Package manager", "status": "open", "summary": "Library folders, versions, dependencies, a registry.", "doc": "all/F-TLS-10.md"},
  {"id": "F-TLS-16", "name": "Smoke test", "status": "done", "summary": "16 small scripts, one feature each, in less than a second, independent of the other tests.", "doc": "all/F-TLS-16.md"},
  {"id": "F-TLS-17", "name": "Benchmarks", "status": "done", "summary": "One per level with a twin in Python, a history of the runs.", "doc": "all/F-TLS-17.md"},
  {"id": "F-TLS-18", "name": "Tutorial pages of the tests", "status": "done", "summary": "features.html and quality.html generated from the tests and the benchmarks (script/genpages.py).", "doc": "all/F-TLS-18.md"},
  {"id": "F-TLS-32", "name": "Test tracking files", "status": "done", "summary": "One JSON file per suite, test/<suite>/<suite>.json, for the levels and for the special tests (smoke, bytecode, scaffold): status, runs, failures, date and reason of every test, and the features of...", "doc": "all/F-TLS-32.md"},
  {"id": "F-VM-04", "name": "Bytecode compiler and VM", "status": "partial", "summary": "Register machine with 32-bit instructions.", "doc": "all/F-VM-04.md"},
  {"id": "F-VM-07", "name": "Portable bytecode file `.evb`", "status": "open", "summary": "Versioned, hashed, with debug lines and capabilities.", "doc": "all/F-VM-07.md"},
  {"id": "F-VM-08", "name": "Embedding API", "status": "open", "summary": "The VM as a library with a C ABI (the C ABI is the contract of the embedding).", "doc": "all/F-VM-08.md"},
  {"id": "F-VM-10", "name": "Cross-platform releases", "status": "partial", "summary": "Windows, Linux, macOS binaries from one build; script/release.py bumps versions.", "doc": "all/F-VM-10.md"},
  {"id": "F-VM-13", "name": "Engine selection and equivalence tests", "status": "done", "summary": "--engine tree\\|bc and EVE_ENGINE; runtest.py --both and bmark.py --both run every test and benchmark on both engines and require equal results; eve --disasm and the golden listings ...", "doc": "all/F-VM-13.md"},
  {"id": "F-VM-14", "name": "Sampling profiler", "status": "done", "summary": "EVE_PROFILE=1 prints the functions with the most samples (Windows, symbols from the .pdb); the optimization steps R1 to R4 were chosen with it.", "doc": "all/F-VM-14.md"},
  {"id": "F-WEB-04", "name": "Web application kit", "status": "open", "summary": "Service + EWP feed + browser client, deployment guide.", "doc": "all/F-WEB-04.md"}
 ]
}
