{
 "$schema": "../schema/features.schema.json",
 "id": "level6",
 "level": 6,
 "name": "The Eve machine and the server",
 "description": "The Eve machine and the server: setup from a folder, control by scripts and by other machines through the doors (IPC, stdio, HTTP), sessions and the machine API `vm.*`, services and routes written in Eve, the editors' link to the machine, and the clients of the machine: `eve` with a user (`-u`, `-a`), the terminal IDE evetx and the native workbench eveux. Capabilities and the Eve Wire Protocol are still open. ",
 "features": [
  {"id": "F-DAT-15", "name": "The user cache `eve.db`", "status": "open", "summary": "A SQLite cache of the user (<user data folder>/eve/meta/eve.db): projects, machines without secrets, history of commands, upload manifest; the Meta interface of evecm, implemented by evedb; rebuilt...", "doc": "level6/F-DAT-15.md"},
  {"id": "F-DOC-03", "name": "Tutorial, network and web part", "status": "open", "summary": "Client and server, services, protocol, security, HTML, WebAssembly.", "doc": "level6/F-DOC-03.md"},
  {"id": "F-LIB-10", "name": "Encryption and hashing", "status": "partial", "summary": "Hashes, HMAC, symmetric encryption (manifest).", "doc": "level6/F-LIB-10.md", "spec": ["library/crypto.md"]},
  {"id": "F-NET-02", "name": "HTTP server", "status": "partial", "summary": "Routes, request and response records, static files, one state per request.", "doc": "level6/F-NET-02.md", "spec": ["library/machine.md", "library/net.md"]},
  {"id": "F-NET-03", "name": "Eve Wire Protocol (EWP)", "status": "open", "summary": "Framed binary protocol for Eve-to-Eve calls and data streams, flow control, resumable streams.", "doc": "level6/F-NET-03.md"},
  {"id": "F-NET-04", "name": "Remote apply", "status": "open", "summary": "Run an aspect on another node with a deadline and an idempotency key.", "doc": "level6/F-NET-04.md"},
  {"id": "F-NET-05", "name": "Capabilities and sandbox", "status": "open", "summary": "Fs, net, db, shell permissions per project and per aspect.", "doc": "level6/F-NET-05.md"},
  {"id": "F-NET-06", "name": "Authentication", "status": "open", "summary": "Tokens, sessions, TLS certificates for services.", "doc": "level6/F-NET-06.md"},
  {"id": "F-NET-07", "name": "Machine login: single sign-on and the keyring", "status": "open", "summary": "From one local machine, a login per remote machine: single sign-on (OpenID Connect), an account of the machine, or a machine token; the renewal token kept in the keyring of the operating system...", "doc": "level6/F-NET-07.md"},
  {"id": "F-NET-08", "name": "The machine API", "status": "partial", "summary": "JSON-RPC 2.0 methods named by part: vm.ping, vm.stat, vm.run, vm.eval, vm.suspend, vm.resume, vm.inspect, vm.cancel, vm.stop; db.; the first names of answered until level 6; no TLS in the machine, a...", "doc": "level6/F-NET-08.md", "spec": ["library/machine.md#lasting-doors-level-6", "library/machine.md#the-machine-api-level-6"]},
  {"id": "F-NET-09", "name": "Credentials, connect and upload", "status": "open", "summary": "Two ways to give credentials: the unversioned eve.env of the project, or a user name and password or a connection string username/password@machine_name; eve --connect before eve --upload; the upload...", "doc": "level6/F-NET-09.md"},
  {"id": "F-NET-10", "name": "Time-outs of the waiting calls", "status": "partial", "summary": "Socket.set_timeout(ms) (a read fails with $err_timeout), service.idle(ms) and the reply 408, os.run! with timeout_ms (status 124).", "doc": "level6/F-NET-10.md", "spec": ["library/net.md#time-outs"]},
  {"id": "F-SPEC-06", "name": "Network semantics and protocol", "status": "open", "summary": "Remote apply, services, Eve Wire Protocol.", "doc": "level6/F-SPEC-06.md"},
  {"id": "F-STR-08", "name": "Service script kind", "status": "open", "summary": "Long-running entry point with routes handled by aspects.", "doc": "level6/F-STR-08.md"},
  {"id": "F-TLS-12", "name": "Machine setup", "status": "open", "summary": "--setup <folder>, the machine folder, eve.cfg, built-in defaults, identity domain + port, external checksum, setup reload.", "doc": "level6/F-TLS-12.md"},
  {"id": "F-TLS-13", "name": "Remote control", "status": "open", "summary": "--listen, eve -c, -rem, -u upload (2026-10-14: the user interface is -ux and the terminal IDE -tx; the upload of is --upload), send between machines, sessions and driver memory spaces (load...", "doc": "level6/F-TLS-13.md"},
  {"id": "F-TLS-14", "name": "Local HTTP", "status": "open", "summary": "serve on port 8042, pages of the web folder, routes of service scripts.", "doc": "level6/F-TLS-14.md"},
  {"id": "F-TLS-15", "name": "Eve API for AI", "status": "open", "summary": "eve --api, an MCP server whose tools are the commands of the machine.", "doc": "level6/F-TLS-15.md"},
  {"id": "F-TLS-19", "name": "eveux, the RAD Workbench: shell", "status": "open", "summary": "an Eve project (service script, aspects, modules) run by the local machine, with a browser part in plain JavaScript and CSS: screen and menus, editor with syntax colors for Eve, SQL, JSON, XML and...", "doc": "level6/F-TLS-19.md"},
  {"id": "F-TLS-20", "name": "eveux: direct SQL and database tree", "status": "open", "summary": "SQL mode of the command window and SQL tabs, results in a grid with Eve types, Commit and Rollback, the database object tree of the connections of a machine, import wizard (code/eveux/ §7...", "doc": "level6/F-TLS-20.md"},
  {"id": "F-TLS-21", "name": "eveux: jobs, logs and admin", "status": "open", "summary": "job browser and scheduler forms over the remote scheduler of every connected machine, live run output, stage view of the aspects, resume from checkpoint, log inspector, admin pages of a machine...", "doc": "level6/F-TLS-21.md"},
  {"id": "F-TLS-22", "name": "eveux: debugger", "status": "open", "summary": "breakpoints in the gutter, step into, over and out, variable inspector, watch window, call stack; needs the debugger of the machine (F-TLS-04) and the commands proposed in.", "doc": "level6/F-TLS-22.md"},
  {"id": "F-TLS-24", "name": "evetx, the terminal IDE: files, editor, run, machines", "status": "partial", "summary": "eve -tx: a full-screen TUI on libvaxis (Zig package, no binding); the title and the main menu (click, or Ctrl+Enter; Save and Save As), two searches under the title bar, each above its panel (names...", "doc": "level6/F-TLS-24.md"},
  {"id": "F-TLS-26", "name": "REPL: selected machine", "status": "open", "summary": "select <machine>, the machine in the status bar (Ready: connection: local), Ctrl+Left/Right and F1 (local), F2, F3 to change machine, Ctrl+Up/Down for the history of commands, help and Tab by machine...", "doc": "level6/F-TLS-26.md"},
  {"id": "F-TLS-27", "name": "evetx: debugger", "status": "open", "summary": "Breakpoints in the gutter and the Breaks tab (remove, double click to jump), Step into, Step out, Continue, Stop, the Watch tab; needs the debugger of the machine (F-TLS-04 b); the same API serves...", "doc": "level6/F-TLS-27.md"},
  {"id": "F-TLS-28", "name": "evetx: databases", "status": "open", "summary": "A database file in the tree opens a table list in a tab; the data of a table in a new tab; the structure of a table in a dialog that is a grid with headers and bordered cells, a drop-down for the...", "doc": "level6/F-TLS-28.md"},
  {"id": "F-TLS-29", "name": "evetx: file card", "status": "open", "summary": "A text file opens in the editor as source (Markdown too); any other file, images, SVG, audio and video included, opens a card with its facts and no preview; the rendered view is in eveux.", "doc": "level6/F-TLS-29.md"},
  {"id": "F-TLS-30", "name": "Service mode", "status": "partial", "summary": "eve -s: the machine with no user interface, silent, both doors, a log and a pid file; a Windows service under the Service Control Manager, a Linux daemon, or the foreground form...", "doc": "level6/F-TLS-30.md"},
  {"id": "F-TLS-31", "name": "eveux: source control", "status": "open", "summary": "Code started: code/eveux/src/vcs/git_status.zig.", "doc": "level6/F-TLS-31.md"}
 ]
}
