{
 "$schema": "../schema/features.schema.json",
 "id": "level5",
 "level": 5,
 "name": "Data and database",
 "description": "The data language and the ETL core: real data with the right types (`Decimal`, `Instant`, records, tables, `Secret`), files and formats (CSV, JSON, text), the HTTP client, generators, generic functions, overloading and the Eve macro, and the database layer with connections, query streams, bulk loads, transactions per job, checkpoints, lineage and the Eve database. It is done when JSON and CSV round-trip, a killed load restarts from its checkpoint, level 5 passes against SQLite and a PostgreSQL server, and `db backup` and `db restore` round-trip.",
 "features": [
  {"id": "F-DAT-01", "name": "Database layer", "status": "partial", "summary": "Connect, parameterized query as a stream, execute, transactions, bulk load.", "doc": "level5/F-DAT-01.md", "spec": ["library/database.md"]},
  {"id": "F-DAT-03", "name": "ETL pipeline model", "status": "partial", "summary": "Extract, transform, load with jobs and aspects; dead-letter output; the pattern taught in the tutorial.", "doc": "level5/F-DAT-03.md", "spec": ["semantics/data-types.md"]},
  {"id": "F-DAT-04", "name": "Checkpoints and restart", "status": "partial", "summary": "Resume a failed pipeline at the last committed batch.", "doc": "level5/F-DAT-04.md", "spec": ["library/database.md#transactions"]},
  {"id": "F-DAT-05", "name": "Columnar tables", "status": "partial", "summary": "Table type with typed columns, Arrow-compatible.", "doc": "level5/F-DAT-05.md"},
  {"id": "F-DAT-06", "name": "Data lineage and run reports", "status": "open", "summary": "Inputs, outputs, row counts, durations per job and aspect.", "doc": "level5/F-DAT-06.md"},
  {"id": "F-DAT-08", "name": "The Eve database", "status": "open", "summary": "The core database: one per project in its db/ folder (default local.db, name set in eve.cfg, system variable $EVE_CORE_DB), SQLite embedded (3.54.0, compiled into the VM from the amalgamation...", "doc": "level5/F-DAT-08.md"},
  {"id": "F-DAT-09", "name": "Database admin commands", "status": "open", "summary": "db list, db add, db test, db info, db tables, db describe, db sql, db create, db backup, db restore, db export, db import, db compact, db runs.", "doc": "level5/F-DAT-09.md", "spec": ["library/database.md#admin-commands"]},
  {"id": "F-DAT-10", "name": "Schema migrations", "status": "open", "summary": "Numbered SQL scripts in db/migrations/<name>/, applied by db migrate and recorded in the Eve database.", "doc": "level5/F-DAT-10.md"},
  {"id": "F-DAT-11", "name": "Record-table mapping", "status": "done", "summary": "table declarations binding record classes to tables, tracked records with dirty fields, updates of the changed fields only, mapping validated in debug mode and refused in production.", "doc": "level5/F-DAT-11.md"},
  {"id": "F-DAT-13", "name": "`sql function`", "status": "partial", "summary": "An Eve function marked sql function is registered on every SQLite and DuckDB connection and called from SQL; deterministic, one result, SQL types, not overloaded; SQL NULL only for nullable types; an...", "doc": "level5/F-DAT-13.md", "spec": ["library/database.md#sql-functions"]},
  {"id": "F-DAT-14", "name": "Stored procedures", "status": "partial", "summary": "Native procedures in sql/ called through external signatures; Eve procedures in proc/, run by the database part, listed by eve db proc list, reloaded by eve db proc reload, called by db.call...", "doc": "level5/F-DAT-14.md", "spec": ["library/database.md#stored-procedures"]},
  {"id": "F-DOC-02", "name": "Tutorial, data client part", "status": "open", "summary": "Files, formats, streams, HTTP client, ETL pipelines.", "doc": "level5/F-DOC-02.md"},
  {"id": "F-LIB-04", "name": "Files and paths", "status": "partial", "summary": "fs and path modules, text and bytes, line streams, globbing.", "doc": "level5/F-LIB-04.md"},
  {"id": "F-LIB-05", "name": "Data formats", "status": "partial", "summary": "JSON and CSV read/write, decode into records; later XML, Parquet.", "doc": "level5/F-LIB-05.md"},
  {"id": "F-LIB-06", "name": "Time and dates", "status": "done", "summary": "now, parse, format, zones, durations.", "doc": "level5/F-LIB-06.md"},
  {"id": "F-LIB-07", "name": "Shell commands", "status": "partial", "summary": "call with pipes, and a safe run(cmd, args, cwd).", "doc": "level5/F-LIB-07.md", "spec": ["library/os.md"]},
  {"id": "F-LIB-08", "name": "Secrets", "status": "done", "summary": "A Secret type and secret.get from environment, file or vault.", "doc": "level5/F-LIB-08.md", "spec": ["library/data-language.md#secrets"]},
  {"id": "F-LIB-09", "name": "Compression and archives", "status": "partial", "summary": "Gzip, zip, stream codecs (manifest).", "doc": "level5/F-LIB-09.md"},
  {"id": "F-LNG-12", "name": "Generators", "status": "done", "summary": "Methods with yield, Generator(:T), use in for and builders.", "doc": "level5/F-LNG-12.md"},
  {"id": "F-LNG-13", "name": "Data types for ETL", "status": "partial", "summary": "Decimal, Instant/DateTime with zone, Date, Time, Duration, Bytes, Uuid.", "doc": "level5/F-LNG-13.md"},
  {"id": "F-LNG-14", "name": "Record types and optional values", "status": "partial", "summary": "Typed records for rows, JSON objects and messages; T?. State: records, null in plain fields and printing of null are tested; the full optional type is in spec/library/data-language.md.", "doc": "level5/F-LNG-14.md", "spec": ["library/data-language.md"]},
  {"id": "F-LNG-20", "name": "Generic functions and procedures", "status": "done", "summary": "A first parameter list of types, function largest(:T <: Comparable)(items:T), called largest(xs) (types inferred) or largest(:Integer)(xs); also procedures, methods and processes; no type list on a...", "doc": "level5/F-LNG-20.md"},
  {"id": "F-LNG-21", "name": "Overloading", "status": "done", "summary": "Functions, procedures and methods share a name with different signatures: number and types of the parameters, and the result type of a function; resolved at compile time, the call must match one...", "doc": "level5/F-LNG-21.md"},
  {"id": "F-NET-01", "name": "HTTP client", "status": "open", "summary": "Requests, headers, JSON bodies, time-outs, TLS.", "doc": "level5/F-NET-01.md"},
  {"id": "F-STR-09", "name": "Eve macro (hybrid script)", "status": "done", "summary": "One self-contained file: shared declarations and several aspects, exactly one of them primary; apply (level 2) and parallel/start (level 4) inside it; a concurrent aspect uses only the thread-safe...", "doc": "level5/F-STR-09.md"},
  {"id": "F-STR-10", "name": "Unified aspect", "status": "done", "summary": "No driver keyword, no free script, no #!; the kinds exclusive, concurrent and primary; main and private processes; calls between aspects at most three levels deep and without a cycle; a concurrent...", "doc": "level5/F-STR-10.md"},
  {"id": "F-STR-11", "name": "`recover` in a function, procedure and method", "status": "done", "summary": "The end of recover handles the error and the routine returns normally; abort passes it on; no recover in a constructor, generator or lambda.", "doc": "level5/F-STR-11.md", "spec": ["semantics/errors.md"]},
  {"id": "F-VM-06", "name": "Efficient collections", "status": "open", "summary": "Hashed and sorted maps, sets, ropes for Text.", "doc": "level5/F-VM-06.md"},
  {"id": "F-VM-11", "name": "One `eve`, its source in modules", "status": "partial", "summary": "The modules evecm, evecp, evevm, evedb, eveux and cmd with one build; one binary whose first word chooses the part, eve vm, cp, db, ux; the serving machine as one process.", "doc": "level5/F-VM-11.md"}
 ]
}
