{
 "$schema": "../schema/features.schema.json",
 "id": "level3",
 "level": 3,
 "name": "Modules and classes",
 "description": "Programs in several files: modules and imports, local libraries, managed and direct modules, extension methods, and then classes and methods with constructors, visibility and inheritance. The standard library of the language is also written as modules from this level on. ",
 "features": [
  {"id": "F-DOC-05", "name": "Library reference", "status": "done", "summary": "Generated by eve --doc for every standard module.", "doc": "level3/F-DOC-05.md"},
  {"id": "F-LIB-03", "name": "Strings, math, collections and type conversions", "status": "done", "summary": "split, join, format, parse, floor, round, sort, search.", "doc": "level3/F-LIB-03.md"},
  {"id": "F-LNG-10", "name": "Classes", "status": "done", "summary": "Attributes, constructors, new, methods with @self, inheritance, visibility; a class hosts only methods and only a method has @self.", "doc": "level3/F-LNG-10.md"},
  {"id": "F-LNG-15", "name": "Typed exceptions", "status": "done", "summary": "Error classes with fields, recover by type, exit-code mapping.", "doc": "level3/F-LNG-15.md"},
  {"id": "F-LNG-16", "name": "Static checks", "status": "partial", "summary": "Name resolution, arity, visibility and type errors before the run (exit 65).", "doc": "level3/F-LNG-16.md"},
  {"id": "F-LNG-19", "name": "Managed and direct modules", "status": "done", "summary": "managed module / direct module (default), per-member thread safety proved by the compiler, a concurrent aspect calls only safe members.", "doc": "level3/F-LNG-19.md"},
  {"id": "F-LNG-30", "name": "Rational numbers", "status": "partial", "summary": "The type Rational: the literal 3\\4, exact arithmetic and comparison, the library module rational.", "doc": "level3/F-LNG-30.md", "spec": ["semantics/types.md#rational", "library/math.md#module-rational"]},
  {"id": "F-LNG-31", "name": "Complex numbers", "status": "partial", "summary": "The type Complex: the imaginary literal i99, (10 + i99), exact comparison without order, the library module complex.", "doc": "level3/F-LNG-31.md", "spec": ["semantics/types.md#complex", "library/math.md#module-complex"]},
  {"id": "F-LNG-22", "name": "External routines and errors of modules", "status": "done", "summary": "An external routine of a module whose name is that of a native module (os, fs, crypto,...) is bound to the native of the same name; an error raised in a module names the file of the module and the...", "doc": "level3/F-LNG-22.md", "spec": ["semantics/modules.md#members"]},
  {"id": "F-SPEC-04", "name": "Library specification", "status": "done", "summary": "Built-ins and standard modules as signatures.", "doc": "level3/F-SPEC-04.md", "spec": ["library/atomic.md"]},
  {"id": "F-STR-01", "name": "Modules and imports", "status": "done", "summary": "module, from … use (…), aliases, m(), (), singletons, initialize/recover/finalize, export, private members, circular imports, $err_module.", "doc": "level3/F-STR-01.md"},
  {"id": "F-STR-03", "name": "Extension methods", "status": "done", "summary": "method name(@self: Class) outside the class.", "doc": "level3/F-STR-03.md"},
  {"id": "F-STR-04", "name": "Projects and search paths", "status": "done", "summary": "Project root $EVE_HOME, asp/, lib/, data/, web/ (templates), out/, $EVE_LIB, $EVE_LIB_PATH.", "doc": "level3/F-STR-04.md"},
  {"id": "F-TLS-02", "name": "REPL", "status": "partial", "summary": "Prompt, file completion, commands check, execute, help, quit; 2026-10-13: the full-screen interface at a terminal (upper part with scrollback, command line between two rules, status bar with Ready /...", "doc": "level3/F-TLS-02.md"},
  {"id": "F-TLS-03", "name": "Interactive interpreter", "status": "open", "summary": "Evaluate Eve statements and expressions typed at the prompt, keep the session scope.", "doc": "level3/F-TLS-03.md"},
  {"id": "F-VM-03", "name": "Library loader and `external` bindings", "status": "done", "summary": "Load .eve library modules and bind external declarations to Zig.", "doc": "level3/F-VM-03.md"}
 ]
}
